Date,Text
2016-02-26,"By strengthening the entire climate services value chain, the Programme improves the accuracy and accessibility of timely weather and climate information for decision-making, adaptation, and risk mitigation at all levels The 3rd OACPS and 1st African Union ClimSA Forum will gather more than three hundred delegates from African, Caribbean and Pacific (ACP) countries, as well as partners of the Intra-ACP Climate Services and Related Applications (ClimSA) programme. Delegates will develop solutions to challenges facing climate service providers and users in… The three proposed pathways outline how to unlock and scale an unprecedented pipeline of investable water projects through greater risk sharing between public and private finance Achieving water security and sustainable sanitation for all in Africa is possible by 2030 and is within the power of African leaders.



Download document 1: https://apo-opa.info/3yWTIYR
Download document 2: https://apo-opa.info/42nQQBM

This is the key message from the International High-Level Panel on Water Investments for Africa, which released a landmark report, Africa’s Rising… The payout will be implemented to assist the lives and livelihoods of 600,000 vulnerable population affected by the drought The Government of Madagascar today received a symbolic cheque in the amount of USD 2,13 million from the African Risk Capacity Insurance Company Limited (ARC Ltd) to cover anticipated losses to livelihoods of its vulnerable population from the crop failure in the just concluded farming season. The ARC payout is… The video below is copyright free and can be used at will, without asking for authorization This material is public and can be used freely  The Directorate of Information and Communication of the African Union Commission (AUC/DIC), would like to share with you the Message from the Secretary General of the African Continental Free Trade Area (AfCFTA) Secretariat, on the Operationalisation of the African Continental Free Trade Area (AfCFTA):

AU Web Site @ https://au.int/en/videos/20200518/message-secretary-general-afcfta-secretariat-operationalisation-african-continental

YouTube @ https://www.youtube.com/watch?v=fPDsjRPu7ks Under the Theme: “Remember-Unite-Renew” Fellow Africans 



Youth, Ladies and Gentlemen 



Today we commemorate the 26th Anniversary of the 1994 Genocide against the Tutsi in Rwanda (KWIBUKA26), under the theme: “Remember-Unite-Renew”. 



This is the twelfth year since the African Union started the annual commemoration of the 1994 Genocide against the Tutsi in Rwanda. However, this…  His Excellency President Matamela Cyril Ramaphosa, President of the Republic of South Arica, in his capacity as Chairperson of the African Union, convened a teleconference of the Bureau of the African Union Heads of State and Government, ahead of the G20 Leaders’ Summit video-teleconference on 26 March 2020.





The Bureau… The video below is copyright free and can be used at will, without asking for authorization This material is public and can be used freely   The meeting reviewed the status of the partnership between the UN and the AU The United Nations-African Union Joint Task Force on Peace and Security held its sixteenth consultative meeting at the African Union headquarters in Addis-Ababa on 12 February 2019.







The African Union (AU) Commission and the United Nations (UN) Secretariat were represented respectively by Commissioners Smaïl Chergui (Peace and Security), Minata Samaté-Cessouma (Political… The Commission calls on all concerned to work for the preservation of peace and stability and the promotion of national harmony in their country The African Union Commission takes note of the decision of the Constitutional Court of the Democratic Repubic of the Congo proclaiming the final results of the presidential and national and provincial and legislative elections of 30 December 2018. 



The Commission calls on all concerned to work for the preservation of… The Chairperson of the Commission stresses that this cowardly attack, once again, underlines the imperative for renewed and reinvigorated efforts to combat terrorism throughout the continent The Chairperson of the Commission of the African Union (AU), Moussa Faki Mahamat, condemns in the strongest possible terms the terrorist attack that took place today against innocent civilians in Nairobi, Kenya. He expresses his deepest condolences to the families of the victims, and wishes a speedy recovery to the… The African Union Commission is the Secretariat of the African Union, a 55- Member State regional organization. Its vision is that of “An integrated, prosperous and peaceful Africa, driven by its own citizens and representing a dynamic force in the global arena” and its mission is to be… By strengthening the entire climate services value chain, the Programme improves the accuracy and accessibility of timely weather and climate information for decision-making, adaptation, and risk mitigation at all levels The three proposed pathways outline how to unlock and scale an unprecedented pipeline of investable water projects through greater risk sharing between public and private finance The payout will be implemented to assist the lives and livelihoods of 600,000 vulnerable population affected by the drought The video below is copyright free and can be used at will, without asking for authorization Under the Theme: “Remember-Unite-Renew”"
